USBDevice init()
making call to findDevices
findDevice()
hub: Bus 003 Device 002: ID 8087:0024
findDevice()
device: Bus 003 Device 003: ID 8087:07da
description: Device Descriptor:
  bLength                 18
  bDescriptorType          1
  bcdUSB                2.00
  bDeviceClass           224 Wireless
  bDeviceSubClass          1
  bDeviceProtocol          1
  bMaxPacketSize0         64
  idVendor            0x8087
  idProduct           0x07da
  bcdDevice            78.69
  iManufacturer            0
  iProduct                 0
  iSerial                  0
  bNumConfigurations       1

hub: Bus 001 Device 002: ID 8087:0024
findDevice()
device: Bus 001 Device 004: ID 2232:1035
description: Device Descriptor:
  bLength                 18
  bDescriptorType          1
  bcdUSB                2.00
  bDeviceClass           239 Unknown
  bDeviceSubClass          2
  bDeviceProtocol          1
  bMaxPacketSize0         64
  idVendor            0x2232
  idProduct           0x1035
  bcdDevice             0.05
  iManufacturer            3
  iProduct                 1
  iSerial                  2
  bNumConfigurations       1

device: Bus 001 Device 005: ID 04f3:001a
description: Device Descriptor:
  bLength                 18
  bDescriptorType          1
  bcdUSB                2.00
  bDeviceClass             0 Per Interface
  bDeviceSubClass          0
  bDeviceProtocol          0
  bMaxPacketSize0          8
  idVendor            0x04f3
  idProduct           0x001a
  bcdDevice             0.10
  iManufacturer            4
  iProduct                14
  iSerial                  0
  bNumConfigurations       1

device != null, claiming interface



